{
  "presetId": "base_safe",
  "title": "Blockbench Base Safe",
  "targetBlockbenchVersion": "5.1.6",
  "purpose": "authoring_and_qa_without_provider_specific_extensions",
  "providerExtensionsAllowed": false,
  "humanInstallationOnly": true,
  "catalog": {
    "repository": "JannisX11/blockbench-plugins",
    "commit": "a33b2d88621cffc119f8e3d94795a2ec350c7290",
    "catalogPath": "plugins.json",
    "auditedAt": "2026-09-11"
  },
  "toolkit": {
    "pluginId": "rpg_asset_toolkit",
    "sourceBundle": "../asset-toolkit/asset_toolkit.js",
    "installArtifact": "../asset-toolkit/rpg_asset_toolkit.js",
    "installArtifactGeneratedOnDemand": true,
    "sourceCommit": "0c95e80ac33fb53d0035155343aeb473e17bb651",
    "installation": "HUMAN_ONLY",
    "mcpPolicy": "READ_ONLY_BRIDGE_ONLY",
    "rollback": "REMOVE_LOCAL_SIDELOAD_AND_RESTART_BLOCKBENCH",
    "smokeRequired": true
  },
  "extensions": [
    {
      "pluginId": "asset_browser",
      "title": "Asset Browser",
      "version": "1.2.2",
      "minBlockbenchVersion": "5.0.0",
      "variant": "desktop",
      "sourcePath": "plugins/asset_browser/asset_browser.js",
      "compatibilityMode": "MIN_VERSION_AND_SMOKE",
      "installation": "HUMAN_ONLY",
      "mcpPolicy": "NEVER",
      "risk": "THIRD_PARTY_LOCAL_PLUGIN_FILESYSTEM",
      "rollback": "REMOVE_VIA_BLOCKBENCH_PLUGIN_DIALOG",
      "smokeRequired": true
    },
    {
      "pluginId": "reference_models",
      "title": "Reference Models",
      "version": "1.1.0",
      "minBlockbenchVersion": "5.0.0",
      "variant": "desktop",
      "sourcePath": "plugins/reference_models/reference_models.js",
      "compatibilityMode": "MIN_VERSION_AND_SMOKE",
      "installation": "HUMAN_ONLY",
      "mcpPolicy": "NEVER",
      "risk": "THIRD_PARTY_LOCAL_PLUGIN",
      "rollback": "REMOVE_VIA_BLOCKBENCH_PLUGIN_DIALOG",
      "smokeRequired": true
    },
    {
      "pluginId": "bone_view",
      "title": "Bone View",
      "version": "1.0.0",
      "minBlockbenchVersion": "4.12.6",
      "variant": "both",
      "sourcePath": "plugins/bone_view/bone_view.js",
      "compatibilityMode": "MIN_VERSION_AND_SMOKE",
      "installation": "HUMAN_ONLY",
      "mcpPolicy": "NEVER",
      "risk": "THIRD_PARTY_LOCAL_PLUGIN",
      "rollback": "REMOVE_VIA_BLOCKBENCH_PLUGIN_DIALOG",
      "smokeRequired": true
    },
    {
      "pluginId": "cameras",
      "title": "Cameras",
      "version": "1.2.2",
      "minBlockbenchVersion": "4.3.0",
      "variant": "both",
      "sourcePath": "plugins/cameras.js",
      "compatibilityMode": "MIN_VERSION_AND_SMOKE",
      "installation": "HUMAN_ONLY",
      "mcpPolicy": "NEVER",
      "risk": "THIRD_PARTY_LOCAL_PLUGIN",
      "rollback": "REMOVE_VIA_BLOCKBENCH_PLUGIN_DIALOG",
      "smokeRequired": true
    },
    {
      "pluginId": "resource_pack_utilities",
      "title": "Resource Pack Utilities",
      "version": "1.10.0",
      "minBlockbenchVersion": "5.0.2",
      "variant": "desktop",
      "sourcePath": "plugins/resource_pack_utilities/resource_pack_utilities.js",
      "compatibilityMode": "MIN_VERSION_AND_SMOKE",
      "installation": "HUMAN_ONLY",
      "mcpPolicy": "NEVER",
      "risk": "THIRD_PARTY_LOCAL_PLUGIN_FILESYSTEM",
      "rollback": "REMOVE_VIA_BLOCKBENCH_PLUGIN_DIALOG",
      "smokeRequired": true
    },
    {
      "pluginId": "uv_locker",
      "title": "UV Locker",
      "version": "1.0.0",
      "minBlockbenchVersion": "5.0.0",
      "variant": "both",
      "sourcePath": "plugins/uv_locker/uv_locker.js",
      "compatibilityMode": "MIN_VERSION_AND_SMOKE",
      "installation": "HUMAN_ONLY",
      "mcpPolicy": "NEVER",
      "risk": "THIRD_PARTY_LOCAL_PLUGIN",
      "rollback": "REMOVE_VIA_BLOCKBENCH_PLUGIN_DIALOG",
      "smokeRequired": true
    },
    {
      "pluginId": "missing_texture_highlighter",
      "title": "Missing Texture Highlighter",
      "version": "0.1.1",
      "minBlockbenchVersion": null,
      "variant": "both",
      "sourcePath": "plugins/missing_texture_highlighter.js",
      "compatibilityMode": "SMOKE_REQUIRED_NO_MIN_VERSION",
      "installation": "HUMAN_ONLY",
      "mcpPolicy": "NEVER",
      "risk": "THIRD_PARTY_LOCAL_PLUGIN",
      "rollback": "REMOVE_VIA_BLOCKBENCH_PLUGIN_DIALOG",
      "smokeRequired": true
    },
    {
      "pluginId": "grayscale_preview",
      "title": "Grayscale Preview",
      "version": "1.0.0",
      "minBlockbenchVersion": "4.3.0",
      "variant": "both",
      "sourcePath": "plugins/grayscale_preview.js",
      "compatibilityMode": "MIN_VERSION_AND_SMOKE",
      "installation": "HUMAN_ONLY",
      "mcpPolicy": "NEVER",
      "risk": "THIRD_PARTY_LOCAL_PLUGIN",
      "rollback": "REMOVE_VIA_BLOCKBENCH_PLUGIN_DIALOG",
      "smokeRequired": true
    },
    {
      "pluginId": "code_view",
      "title": "Code View",
      "version": "1.0.1",
      "minBlockbenchVersion": null,
      "variant": "both",
      "sourcePath": "plugins/code_view.js",
      "compatibilityMode": "SMOKE_REQUIRED_NO_MIN_VERSION",
      "installation": "HUMAN_ONLY",
      "mcpPolicy": "NEVER",
      "risk": "THIRD_PARTY_LOCAL_PLUGIN",
      "rollback": "REMOVE_VIA_BLOCKBENCH_PLUGIN_DIALOG",
      "smokeRequired": true
    },
    {
      "pluginId": "brush_tuna",
      "title": "Brush Tuna",
      "version": "1.0.6",
      "minBlockbenchVersion": "5.1.4",
      "variant": "both",
      "sourcePath": "plugins/brush_tuna/brush_tuna.js",
      "compatibilityMode": "MIN_VERSION_AND_SMOKE",
      "installation": "HUMAN_ONLY",
      "mcpPolicy": "NEVER",
      "risk": "THIRD_PARTY_LOCAL_PLUGIN",
      "rollback": "REMOVE_VIA_BLOCKBENCH_PLUGIN_DIALOG",
      "smokeRequired": true
    },
    {
      "pluginId": "colour_gradient_generator",
      "title": "Colour Gradient Generator",
      "version": "3.0.0",
      "minBlockbenchVersion": "5.0.0",
      "variant": "both",
      "sourcePath": "plugins/colour_gradient_generator/colour_gradient_generator.js",
      "compatibilityMode": "MIN_VERSION_AND_SMOKE",
      "installation": "HUMAN_ONLY",
      "mcpPolicy": "NEVER",
      "risk": "THIRD_PARTY_LOCAL_PLUGIN",
      "rollback": "REMOVE_VIA_BLOCKBENCH_PLUGIN_DIALOG",
      "smokeRequired": true
    }
  ],
  "installationOrder": [
    "rpg_asset_toolkit",
    "asset_browser",
    "reference_models",
    "bone_view",
    "cameras",
    "resource_pack_utilities",
    "uv_locker",
    "missing_texture_highlighter",
    "grayscale_preview",
    "code_view",
    "brush_tuna",
    "colour_gradient_generator"
  ]
}
